{
  "agent": "copilot",
  "branch": "copilot/release-or-transfer-claims-on-handoff",
  "ended_at": "2026-10-07T13:14:16Z",
  "evidence": [
    "commit:0f35e18",
    "command:CodeQL Python scan reported 0 alerts"
  ],
  "files_changed": [
    "coordination/README.md",
    "scripts/collaboration.py",
    "tests/test_collaboration.py"
  ],
  "limitations": [
    "Repository-wide coordination validation remains blocked by missing evidence references in pre-existing completed task records; no unrelated records were changed.",
    "The parallel Code Review runner was unavailable in this environment; CodeQL completed with 0 alerts."
  ],
  "model": null,
  "next_action": "Owner reviews the PR; a receiving agent can then claim the released paths under its own identity.",
  "paths": [
    "coordination/README.md",
    "scripts/collaboration.py",
    "tests/test_collaboration.py"
  ],
  "repo_commit_after": "0f35e18ab5e5b01df0c1bde69f67c9fe7fe4aa5c",
  "repo_commit_before": "8c23a7d2b6416fd943acc6fb34174eb53c227559",
  "ruled_out": [
    "Keeping a handed-off task in active ownership would prevent a receiver from creating a new identity-bearing claim."
  ],
  "schema_version": 1,
  "session_id": null,
  "started_at": "2026-10-07T13:11:12Z",
  "status": "completed",
  "summary": "Release claimed paths after handoff while preserving historical ownership",
  "supersedes": [],
  "surface": "copilot-cloud",
  "task_id": "release-handoff-claims-20261007",
  "tests": [
    "PYTHONPATH=/tmp/veronica-test-deps python -m pytest tests/test_collaboration.py -q (9 passed)",
    "python -m py_compile scripts/collaboration.py tests/test_collaboration.py (passed)",
    "git diff HEAD^ HEAD --check (passed)",
    "python scripts/collaboration.py validate (blocked by pre-existing missing-evidence records)"
  ],
  "worktree": "/home/runner/work/Veronica.v4/Veronica.v4"
}
