{
  "agent": "copilot",
  "branch": "copilot/keep-one-click-approval-aligned",
  "ended_at": "2026-10-07T13:12:42Z",
  "evidence": [
    "scripts/start-veronica-universal.ps1; tests/test_universal_start.py; plan-only output"
  ],
  "files_changed": [
    "scripts/start-veronica-universal.ps1",
    "tests/test_universal_start.py"
  ],
  "limitations": [
    "No live or paid launch was attempted; uv was unavailable, so the repository-locked pytest version was installed for the test run."
  ],
  "model": null,
  "next_action": "Review the committed diff and merge the issue fix; do not start a Pod as part of this code change.",
  "paths": [
    "scripts/start-veronica-universal.ps1",
    "tests/test_universal_start.py"
  ],
  "repo_commit_after": "5a08c4039ab744cfe45c53abfcfd3cad82ea95e3",
  "repo_commit_before": "f54fa6810045cc86e798f8b3be742b7fa33ac606",
  "ruled_out": [],
  "schema_version": 1,
  "session_id": null,
  "started_at": "2026-10-07T13:11:06Z",
  "status": "completed",
  "summary": "Align one-click approval rate with launcher default",
  "supersedes": [],
  "surface": "copilot-cloud",
  "task_id": "issue-22-one-click-hourly-rate",
  "tests": [
    "python -m pytest tests/test_universal_start.py tests/test_start_veronica.py (42 passed, 1 skipped)",
    "PowerShell approval-rate check (1.75 approved; 2.09 ceiling)"
  ],
  "worktree": "/home/runner/work/Veronica.v4/Veronica.v4"
}
