{
  "agent": "codex",
  "branch": "main",
  "ended_at": "2026-09-27T09:09:16Z",
  "evidence": [
    "commit:b4ffe0c"
  ],
  "files_changed": [
    "runs/2026-09-27-t2-revalidation/decision.md",
    "runs/2026-09-27-t2-revalidation/revalidation.json"
  ],
  "limitations": [
    "Live qualification remains hold pending clean CP4 integration and runtime attestations."
  ],
  "model": "gpt-6-astra",
  "next_action": "Integrate the provenance-byte repair before CP4, then revalidate the complete T2 packet from that exact clean checkout.",
  "paths": [
    "config/t2-comparison-inputs.template.json",
    "config/t2-qualification.json",
    "coordination/handoffs/qualification-revalidation-20260927.md",
    "runs/2026-09-27-t2-revalidation",
    "scripts/configuration_fingerprint.py",
    "scripts/verify_t2_qualification.py",
    "src/veronica_core/qualification.py",
    "tests/test_qualification.py"
  ],
  "repo_commit_after": "7435489c79368e9b5311c63b0377790ecfb79f94",
  "repo_commit_before": "7435489c79368e9b5311c63b0377790ecfb79f94",
  "ruled_out": [
    "No paid compute or inference."
  ],
  "schema_version": 1,
  "session_id": null,
  "started_at": "2026-09-27T09:03:16Z",
  "status": "completed",
  "summary": "Reproduce and repair offline T2 packet hash and chat-template provenance validation without paid compute; preserve fail-closed behavior.",
  "supersedes": [],
  "surface": "codex-desktop",
  "task_id": "qualification-revalidation-20260927",
  "tests": [
    "See clean-checkout validation recorded by commit:b4ffe0c"
  ],
  "worktree": "C:\\Users\\raine\\DEVELOPMENT\\Projects\\Veronica.v4"
}
