{
  "agent": "codex",
  "branch": "main",
  "ended_at": "2026-09-23T18:01:45Z",
  "evidence": [
    "runs/2026-09-23T153339Z-start-veronica/decision.md",
    "runs/2026-09-23T153339Z-start-veronica/startup-cancelled.json"
  ],
  "files_changed": [
    "runs/2026-09-23T153339Z-start-veronica"
  ],
  "limitations": [
    "No Pod was created and no model qualification evidence exists"
  ],
  "model": null,
  "next_action": "Use the later 2026-09-23T163608Z fallback record for any live-run evidence; require fresh authorization for another paid run",
  "paths": [
    "runs/2026-09-23T090000Z-start-veronica"
  ],
  "repo_commit_after": "7435489c79368e9b5311c63b0377790ecfb79f94",
  "repo_commit_before": "7435489c79368e9b5311c63b0377790ecfb79f94",
  "ruled_out": [],
  "schema_version": 1,
  "session_id": null,
  "started_at": "2026-09-23T15:33:39Z",
  "status": "completed",
  "summary": "Owner-authorized one-hour A100 Veronica startup with 1.75 dollar hourly cap",
  "supersedes": [],
  "surface": "codex-desktop",
  "task_id": "start-veronica-one-hour-20260923",
  "tests": [
    "decision.md records cancelled before Pod creation"
  ],
  "worktree": "C:\\Users\\raine\\DEVELOPMENT\\Projects\\Veronica.v4"
}
