{
  "agent": "copilot",
  "branch": "copilot/replace-dangling-bootstrap-commit-reference",
  "ended_at": null,
  "evidence": [],
  "files_changed": [],
  "limitations": [],
  "model": null,
  "next_action": null,
  "paths": [
    "coordination/handoffs/collaboration-bootstrap.md",
    "coordination/tasks/completed/collaboration-bootstrap.json",
    "scripts/collaboration.py",
    "tests/test_collaboration.py"
  ],
  "repo_commit_after": null,
  "repo_commit_before": "d3851f97d0e93910868efda3c0f6635b6586785d",
  "ruled_out": [],
  "schema_version": 1,
  "session_id": null,
  "started_at": "2026-10-07T13:11:27Z",
  "status": "active",
  "summary": "Replace the unreachable bootstrap evidence commit and reject invalid commit evidence in completed records",
  "supersedes": [],
  "surface": "copilot-cloud",
  "task_id": "fix-bootstrap-commit-validation",
  "tests": [],
  "worktree": "/home/runner/work/Veronica.v4/Veronica.v4"
}
