{
  "agent": "copilot",
  "branch": "copilot/preserve-numeric-token-usage",
  "ended_at": null,
  "evidence": [],
  "files_changed": [],
  "limitations": [],
  "model": null,
  "next_action": null,
  "paths": [
    "docs/evals/README.md",
    "src/veronica_core/evaluation.py",
    "tests/test_evaluation.py"
  ],
  "repo_commit_after": null,
  "repo_commit_before": "64222b7e57010a5d385b4365b960dce5fce171d0",
  "ruled_out": [],
  "schema_version": 1,
  "session_id": null,
  "started_at": "2026-10-07T13:11:42Z",
  "status": "active",
  "summary": "Preserve usage counters while redacting credentials in evaluator evidence",
  "supersedes": [],
  "surface": "copilot-cloud",
  "task_id": "evaluator-numeric-token-redaction-20261007",
  "tests": [],
  "worktree": "/home/runner/work/Veronica.v4/Veronica.v4"
}
