{
  "agent": "codex",
  "branch": "main",
  "ended_at": "2026-09-26T09:18:42Z",
  "evidence": [
    "runs/2026-09-25-core-baseline/integration-review-20260926.md"
  ],
  "files_changed": [
    "docs/goals/CORE-BASELINE-20260925.md",
    "runs/2026-09-25-core-baseline/integration-review-20260926.md"
  ],
  "limitations": [
    "test_start_veronica.py exceeds the current terminal command window; no startup code was changed.",
    "Focused commit a6126ef is not yet integrated into main."
  ],
  "model": null,
  "next_action": "Resolve G0.2 launch-policy conflict and G0.3 startup test capture, then integrate a6126ef through a clean branch.",
  "paths": [
    "docs/goals/CORE-BASELINE-20260925.md",
    "runs/2026-09-25-core-baseline"
  ],
  "repo_commit_after": "7435489c79368e9b5311c63b0377790ecfb79f94",
  "repo_commit_before": "7435489c79368e9b5311c63b0377790ecfb79f94",
  "ruled_out": [],
  "schema_version": 1,
  "session_id": null,
  "started_at": "2026-09-25T19:50:50Z",
  "status": "completed",
  "summary": "G0 baseline tests and specialized-agent integration evidence for CORE completion",
  "supersedes": [],
  "surface": "codex-desktop",
  "task_id": "core-baseline-20260925",
  "tests": [
    "focused evaluator/context suite: 98 passed, exit 0",
    "pytest tests -q --ignore tests/test_start_veronica.py: 310 passed, 8 skipped, exit 0"
  ],
  "worktree": "C:\\Users\\raine\\DEVELOPMENT\\Projects\\Veronica.v4"
}
