{
  "agent": "copilot",
  "branch": "copilot/keep-one-click-approval-aligned",
  "ended_at": null,
  "evidence": [],
  "files_changed": [],
  "limitations": [],
  "model": null,
  "next_action": null,
  "paths": [
    "scripts/start-veronica-universal.ps1",
    "tests/test_universal_start.py"
  ],
  "repo_commit_after": null,
  "repo_commit_before": "f54fa6810045cc86e798f8b3be742b7fa33ac606",
  "ruled_out": [],
  "schema_version": 1,
  "session_id": null,
  "started_at": "2026-10-07T13:11:06Z",
  "status": "active",
  "summary": "Align one-click approval rate with launcher default",
  "supersedes": [],
  "surface": "copilot-cloud",
  "task_id": "issue-22-one-click-hourly-rate",
  "tests": [],
  "worktree": "/home/runner/work/Veronica.v4/Veronica.v4"
}
