{
  "agent": "codex",
  "branch": "feature/complete-todo-milestones",
  "ended_at": "2026-09-23T18:00:54Z",
  "evidence": [
    "runs/2026-09-23T082530Z-start-veronica/termination.json",
    "runs/2026-09-23T082530Z-start-veronica/decision.md"
  ],
  "files_changed": [
    "runs/2026-09-23T082530Z-start-veronica"
  ],
  "limitations": [
    "No model qualification claimed; retained volume/evidence remain separate"
  ],
  "model": null,
  "next_action": "Use retained evidence only after owner review; no new paid run without fresh authorization",
  "paths": [
    "config/runpod-t2-alternative.json",
    "runs/2026-09-23T082530Z-start-veronica"
  ],
  "repo_commit_after": "7435489c79368e9b5311c63b0377790ecfb79f94",
  "repo_commit_before": "ac22d3c7ee87669a153ecd0119ee71a0cb9b4c6f",
  "ruled_out": [],
  "schema_version": 1,
  "session_id": null,
  "started_at": "2026-09-23T08:26:20Z",
  "status": "completed",
  "summary": "Launch explicitly approved 2.09 dollar secure alternative for one hour",
  "supersedes": [],
  "surface": "codex-desktop",
  "task_id": "alternative-secure-start",
  "tests": [
    "termination.json confirmedAbsent=true"
  ],
  "worktree": "C:\\Users\\raine\\DEVELOPMENT\\Projects\\Veronica.v4"
}
