{
  "agent": "codex",
  "branch": "main",
  "ended_at": "2026-09-26T09:37:10Z",
  "evidence": [
    "coordination/tasks/completed/launch-policy-20260926.json"
  ],
  "files_changed": [
    "config/runpod-core.json",
    "config/runpod-t2-alternative.json",
    "docs/STARTING-PROCEDURE.md"
  ],
  "limitations": [
    "Policy files remain uncommitted in the dirty main checkout pending focused integration."
  ],
  "model": null,
  "next_action": "Review and integrate the completed policy and startup-test changes with the ordered evaluator dependency repair.",
  "paths": [
    "config/runpod-core.json",
    "config/runpod-t2-alternative.json",
    "docs/STARTING-PROCEDURE.md"
  ],
  "repo_commit_after": "7435489c79368e9b5311c63b0377790ecfb79f94",
  "repo_commit_before": "7435489c79368e9b5311c63b0377790ecfb79f94",
  "ruled_out": [],
  "schema_version": 1,
  "session_id": null,
  "started_at": "2026-09-26T09:37:03Z",
  "status": "completed",
  "summary": "Normalize line endings in completed launch-policy changes so diff validation is clean",
  "supersedes": [],
  "surface": "codex-desktop",
  "task_id": "g0-policy-diff-hygiene-20260926",
  "tests": [
    "git diff --check on launch-policy paths: exit 0"
  ],
  "worktree": "C:\\Users\\raine\\DEVELOPMENT\\Projects\\Veronica.v4"
}
