{
  "agent": "codex",
  "branch": "feature/complete-todo-milestones",
  "ended_at": "2026-09-17T04:24:58Z",
  "evidence": [
    "runs/2026-09-17-collaboration-integration/decision.md"
  ],
  "files_changed": [
    "AGENTS.md",
    "docs/CREATED-WORKING-SYSTEM.md",
    "docs/CURRENT-STATE.md"
  ],
  "limitations": [
    "PR 5 remains open; task claims are per checkout, not global locks"
  ],
  "model": null,
  "next_action": "Fix executable evaluation isolation gate; finish qualification readiness",
  "paths": [
    "AGENTS.md",
    "docs/CORE-COMPLETION-PLAN.md",
    "docs/CREATED-WORKING-SYSTEM.md",
    "docs/CURRENT-STATE.md",
    "runs/2026-09-17-collaboration-integration"
  ],
  "repo_commit_after": "a93bf759c35c62f8ef3ec2953792afccc02800e9",
  "repo_commit_before": "a93bf759c35c62f8ef3ec2953792afccc02800e9",
  "ruled_out": [],
  "schema_version": 1,
  "session_id": null,
  "started_at": "2026-09-17T04:23:16Z",
  "status": "completed",
  "summary": "Integrate reviewed collaboration code into the existing milestone branch and preserve current continuity",
  "supersedes": [],
  "surface": "codex-desktop",
  "task_id": "core-collaboration-integration",
  "tests": [
    "scripts/verify-local.ps1: 199 passed, 1 skipped; contracts/provenance/import passed",
    "collaboration validate and staged diff check passed"
  ],
  "worktree": "C:\\Users\\raine\\DEVELOPMENT\\Projects\\Veronica.v4"
}
