{
  "agent": "codex",
  "branch": "feature/complete-todo-milestones",
  "ended_at": "2026-09-23T03:42:03Z",
  "evidence": [
    "Verified status plan and CP2 handoff recorded in runs/2026-09-22-core-status-plan/decision.md"
  ],
  "files_changed": [
    "docs/CORE-COMPLETION-PLAN.md",
    "docs/CORE-STATUS-AND-EXECUTION-PLAN.md",
    "docs/CURRENT-STATE.md",
    "runs/2026-09-22-core-status-plan/decision.md"
  ],
  "limitations": [
    "No paid Pod started; foundation qualification remains open"
  ],
  "model": null,
  "next_action": "Implement M1 CP2 actual-token context packet and checkpoint it before CP3",
  "paths": [
    "TODO.md",
    "docs/CORE-COMPLETION-PLAN.md",
    "docs/CORE-STATUS-AND-EXECUTION-PLAN.md",
    "docs/CURRENT-STATE.md",
    "docs/NEXT-MILESTONES.md",
    "runs/2026-09-22-core-status-plan"
  ],
  "repo_commit_after": "479489f8dae4ec48171dbb81c6a5adc788f3c672",
  "repo_commit_before": "479489f8dae4ec48171dbb81c6a5adc788f3c672",
  "ruled_out": [],
  "schema_version": 1,
  "session_id": null,
  "started_at": "2026-09-23T03:39:32Z",
  "status": "completed",
  "summary": "Clarify verified accomplishments, remaining work, and checkpointed Core execution plan",
  "supersedes": [],
  "surface": "codex-desktop",
  "task_id": "core-status-execution-plan",
  "tests": [
    "git diff --check",
    "python scripts/collaboration.py validate",
    "uv run pytest tests -q"
  ],
  "worktree": "C:\\Users\\raine\\DEVELOPMENT\\Projects\\Veronica.v4"
}
